LEAK_ID,RPT_TYPE,RPT_DATE,ADDRESS,MAIN_ST,CROSS_ST,PIPE_SIZE,PIPE_TYPE,YR_INST,PLR_INST,LEAK_TYPE,LEAK_QUANT,ANOD_INST,COAT_TYPE,COAT_COND,SOIL_TYPE,FOREMAN,WSM_NBR,REPAIR_HRS,MAN_HRS,REMARKS,LAT,LON,MEANgid,COUNT
65040,MAIN,4-May-13,LAS PALMAS,20' E/W LAS PALMAS,7' S/S 2ND ST.,6.000000000000000,C.I.,1924,35161,,1,,,,,T. BLACK,138-186,1.000000000000000,3.000000000000000,"WHILE RETURNING MAIN TO SERVICE FOUND CRACK IN MAIN. DUG, PUT, AND MADE REPAIR USING 360 DEGREE CLAMP.",34.070934620000003,-118.335943900000004,10.0000000000000000,1.0000000000000000
65043,MAIN,7-May-13,301 N. LAS PALMAS AVE.,20' E/W LAS PALMAS,42' N/N BEVERLY BLVD.,6.000000000000000,C.I.,1924,35161,,1,,,,,T. BLACK,140-186,2.000000000000000,14.000000000000000,WHILE EXCAVATING BAND LEAK OR THREADED SUDDLE. CUT OLD SUDDLE AND REPLACED WITH 360 DEGREE REPAIR CLAMP.,34.076444639999998,-118.336031199999994,10.0000000000000000,1.0000000000000000
65062,MAIN,8-May-13,351 S. VAN NESS AVE.,24' E/W VAN NESS AVE,50' N/N 4TH ST.,61.000000000000000,STEEL,1961,80209,,1,,,,,R. GONZALES,136-192,9.000000000000000,45.000000000000000,"FOUND CONTROL LINE LEAK OFF 61"" STEEL MAIN REFIT CONTROL HEAD.",34.067359889999999,-118.315161399999994,10.0000000000000000,1.0000000000000000
65049,MAIN,11-May-13,1563 SUNSET PLAZA DR.,8' S/N SUNSET PLAZA DR,40' W/W FOREST KNOLLS,6.000000000000000,STEEL,1927,44765,RUST HOLE,1,,,,B,T.SMITH,148-171,8.000000000000000,32.000000000000000,"""FLAGMEN REQUIRED"" LOCATE LEAK, DUG OUT, PINCH DOWN REQUIRED. INSTALL CLAMP, BACKFILL, & TEMP. P/N MADE, P/N DELINEATION, JOB COMPLETE.",34.098860389999999,-118.380322199999995,10.0000000000000000,1.0000000000000000
65059,MAIN,12-May-13,6760  LEXINGTON AVE.,17' E/W MC CADDEN PL.,6' N/S LEXIINGTON AVE.,8.000000000000000,C.I.,1930,49752,SPLIT,1,,,,C,R. GONZALES,146-183,11.000000000000000,22.000000000000000,"FOUND LEAK ON 8"" C.I. MAIN CUT IN 7' OF 8"" D.I. WITH TWO UNIONS.",34.092526040000003,-118.337479000000002,10.0000000000000000,1.0000000000000000
65075,MAIN,16-May-13,7964 WILLOW GLEN RD.,10' NS WILLOW GLEN RD,874' W/W WOODSTOCK RD.,6.000000000000000,STEEL,1936,47672,RUST HOLE,1,,,MED,DECOMP GRANITE,C. SCHWEINBOLD,154-174,8.000000000000000,23.000000000000000,"REPAIRED 2 RUPTURES ON WATER MAIN. USED REDUCER, CLAMP, 1 SCREW PIN. BACKFILLED, TAMPED, & OILED. HELP MAKE PICK-UP, CLEAN, & SWEPT AREA.",34.119602260000001,-118.370647199999993,10.0000000000000000,1.0000000000000000
65084,MAIN,19-May-13,1420 SUNSET PLAZA DR.,9' SN SUNSET PLAZA DR,799' E/E RISING GLEN RD.,6.000000000000000,STEEL,1929,48083,RUST HOLE,3,,,,LOAM,M. SPEARS,146-171,6.000000000000000,18.000000000000000,"REPAIRED 3 LEAKS ON 6"" STEEL MAIN. 2 LEAKS WITH 6"" X 12"" 360 DEGREE CLAMPS. 1 LEAK WITH LARGE SCREWPIN.",34.096030040000002,-118.382168600000000,10.0000000000000000,1.0000000000000000
65090,MAIN,20-May-13,836 SPAULDING AVE.,23' W/E SPAULDING AVE.,387' S/S 8TH ST.,6.000000000000000,C.I.,1954,70833,SPLIT,1,,,LIGHT,CLAY,C. SCHWEINBOLD,134-177,5.000000000000000,19.000000000000000,"REPAIRED SMALL SPLIT ON 6"" C.I. WATER MAIN AT CLAMP. BACKFILLED, TAMPED, & OILED. HELP MAKE PICK-UP, CLEAN & SWEPT AREA.",34.059715799999999,-118.358834599999994,10.0000000000000000,1.0000000000000000
65101,MAIN,22-May-13,308 N. LAS PALMAS AVE.,20' E/W N LAS PALMAS AVE.,151' N/N BEVERLY BLVD.,6.000000000000000,C.I.,1924,35161,,1,,,,,T. BLACK,140-186,1.500000000000000,10.500000000000000,"WHILE EXCAVATING SERVICE, FOUND MAIN LEAK. MADE REPAIR WITH 360 DEGREE REPAIR CLAMP. CLEANED SITE, MADE SAFE.",34.076744300000001,-118.335992000000005,10.0000000000000000,1.0000000000000000
65104,MAIN,22-May-13,448 N. LAS PALMAS AVE.,20' E/W LAS PALMAS AVE,190' S/S ROSEWOOD AVE.,6.000000000000000,C.I.,1924,35161,,1,,,,,T. BLACK,140-186,1.500000000000000,10.500000000000000,FOUND HOLE ON TOP OF MAIN. NEXT TO SERVICE. MADE REPAIR USING VENTED CLAMP. CLEANED SITE AND MADE SAFE.,34.079699150000003,-118.335794000000007,10.0000000000000000,1.0000000000000000
65105,MAIN,23-May-13,317 N. LAS PALMAS AVE.,20' E/W LAS PALMAS AVE,164' N/N BEVERLY BLVD.,6.000000000000000,C.I.,1924,35161,,1,,,,,T. BLACK,140-186,2.000000000000000,6.000000000000000,FOUND WATER SPRAYING FROM BETWEEN MAIN AND SADDLE. REMOVEED AND REPLACED SADDLE.,34.076780040000003,-118.335987399999993,10.0000000000000000,1.0000000000000000
65113,MAIN,28-May-13,1340 SUNSET PLAZA DR.,9' SN SUNSET PLAZA DR,17' E/E RISING GLEN RD.,6.000000000000000,STEEL,1929,48083,RUST HOLE,1,,,,,W. KELLY,146-171,,,"6' X 8"" 360 DEGREE CLAMP.",34.096357300000001,-118.383371299999993,10.0000000000000000,1.0000000000000000
65123,MAIN,29-May-13,6650 SANTA MONICA BLVD.,20' NS SANTA MONICA BLVD,363 E/E LAS PALMAS AVE.,6.000000000000000,C.I.,1920,27053,RUTURE,1,,,,,J. RODRIGUEZ,144-186,9.500000000000000,47.500000000000000,"FOUND RUTURE ON 6"" C.I. CUT OUT 4' OF CI REPLACE WITH 4' OF D.I. JOB SITE WAS LEFT CLEAN AND SAFE.",34.090664339999996,-118.334923700000004,10.0000000000000000,1.0000000000000000
65118,MAIN,29-May-13,6310 THIRD ST.,26' S/N THIRD STREET,3' W/W GILMORE LANE,8.000000000000000,C.I.,1949,66974,GATE,1,,,,,R. GONZALES,138-177,6.500000000000000,19.500000000000000,"CUT OUT ABANDONED 4"" GATE AND TEE. INSTALLED 3' OF 8"" D.I. WITH TWO UNIONS.",34.071297790000003,-118.359453700000003,10.0000000000000000,1.0000000000000000
65050,MAIN,3-Jun-13,8320 YUCCA TRAIL,7' NS YUCCA TRAIL,1225' NN KIRKWOOD DR,4.000000000000000,STEEL,1926,43232,CLAMP,1,,,NONE,LOAM,SPEARS,150-174,4.000000000000000,12.000000000000000,"TIGHTENED 4""X 12"" CLAMP ON 11 DEGREE BEND OF 4"" STEEL MAIN TO STOP RUST HOLE LEAK ON BOTTOM OF MAIN.",34.104486569999999,-118.371742499999996,10.0000000000000000,1.0000000000000000
65054,MAIN,4-Jun-13,5601 BRAIRCLIFF,20' NS BRAIRCLIFF,113' WW VERDE OAK DR,4.000000000000000,STEEL,1924,34659,RUST HOLE,1,,,BAD,SANDSTONE,WASHINGTON,152-192,5.000000000000000,10.000000000000000,"INSTALLED 4""X 12"" 360 DEGREE CLAMP. MAIN HAD 4 HOLES IN IT. BACKFILL & OIL COMPLETE, NEEDS LARGE PICK UP ONLY.",34.108873150000001,-118.312360299999995,10.0000000000000000,1.0000000000000000
65053,MAIN,4-Jun-13,1340 SUNSET PLAZA DRIVE,S/N SUNSET PLAZA DRIVE,17' EE RISING GLEN ROAD,6.000000000000000,STEEL,1929,48083,CLAMP,1,,,,,KELLY,146-171,5.000000000000000,15.000000000000000,"REPLACED LEAKY CLAMP W/ (1) 6"" HIGH PRESSURE CLAMP: COVERED EXPOSED COMMUNICATION LINES; RESET PLATE.",34.096358590000001,-118.383370499999998,10.0000000000000000,1.0000000000000000
65057,MAIN,5-Jun-13,101 S PLYMOUTH BLVD,W PLYMOUTH BLVD,55' S/N 1ST STREET,6.000000000000000,C.I.,1920,27188,SPLIT,1,,,,SANDY,KELLY,138-189,9.000000000000000,36.000000000000000,"REPAIRED 6"" MAIN LEAK: REPLACED 5FT OF PIPE.",34.073667659999998,-118.320812399999994,10.0000000000000000,1.0000000000000000
65057,MAIN,5-Jun-13,101 S PLYMOUTH BLVD,W PLYMOUTH BLVD,55' S/N 1ST STREET,6.000000000000000,C.I.,1920,27188,SPLIT,1,,,,SANDY,KELLY,138-189,9.000000000000000,36.000000000000000,"REPAIRED 6"" MAIN LEAK: REPLACED 5FT OF PIPE.",34.073504430000000,-118.320887600000006,10.0000000000000000,1.0000000000000000
65204,MAIN,6-Jun-13,2915 ST GEORGE ST,22' E/W ST. GEORGE ST.,132' N/N MONON ST.,6.000000000000000,C.I.,1923,30987,,1,,,,,D. SOLIS,152-204,6.000000000000000,18.000000000000000,"BROKE OUT; EXPOSE; REPAIR; BACKFILL; TEMP.. JOB SITE SAFE AND CLEAN.",34.110009079999998,-118.273534799999993,10.0000000000000000,1.0000000000000000
65061,MAIN,12-Jun-13,200 S LAS PALMAS AVE,20' E/W LAS PALMAS AVE,327' N/N 3RD ST,6.000000000000000,C.I.,1924,35161,SPLIT,1,,,N/A,B,SMITH,136-186,14.000000000000000,42.000000000000000,"DUG OUT, CUT IN 6' W/ CPLGS. BACKFILL LARGE EXCAVATION, MUD CLEAN-UP - BROKE OUT 3'X 30' OF STREET DAMAGE. TEMP OIL.",34.069937019999998,-118.335939199999999,10.0000000000000000,1.0000000000000000
65067,MAIN,15-Jun-13,1401 SUNSET PLAZA,10' SN SUNSET PLAZA,654 E/E RISING GLEN RD,6.000000000000000,STEEL,1929,48083,RUST HOLE,1,,,,,JIMENEZ,146-171,8.000000000000000,24.000000000000000,"FOUND RUST HOLE ON 6"" STL WM, REPAIRED WITH 6X 12 HIGH PRESSURE 360 DEGREE CLAMP BACKFILLED, TEMP OIL, CLEAN UP JOBSITE SAFE.",34.096481079999997,-118.382767000000001,10.0000000000000000,1.0000000000000000
65074,MAIN,18-Jun-13,3050 RUNYON CYN RD,1628' SS MULHOLLAND DR,10' EW RUNYON CYN RD,6.000000000000000,STEEL,1926,43116,RUST HOLE,1,,,,C,GONZALES,154-180,14.500000000000000,58.000000000000000,"FOUND RUST HOLE ON 6"" STL MAIN USED 6""X 12"" CLAMP FOR REPAIR.",34.116245839999998,-118.351495000000000,10.0000000000000000,1.0000000000000000
65080,MAIN,19-Jun-13,3050 RUNYON CYN RD,200' S/S MULHOLLAND DR,8' EW RUNYON CYN RD,6.000000000000000,STEEL,,,RUST HOLE,1,,,,C,GONZALES,154-180,6.000000000000000,12.000000000000000,"FOUND LEAK ON 6"" STL MAIN USED 6""X 12"" CLAMP FOR REPAIR.",34.114550330000000,-118.351023699999999,10.0000000000000000,1.0000000000000000
65149,MAIN,21-Jun-13,2755 JALMIA DR,3' SN JALMIA DR,6' NS JALMIA DR,1.000000000000000,COPPER,,,JOINT,1,,,,,GONZALES,154-177,7.500000000000000,15.000000000000000,"FOUND OLD CLAMP LEAKING CUT IN 3' OF 1"" COPPER WITH TWO UNIONS",34.118707870000001,-118.359876000000000,10.0000000000000000,1.0000000000000000
65086,MAIN,21-Jun-13,1511 SUNSET PLAZA DR,100' N/N STEBBINS TERR,6' E/W SUNSET PLAZA DR,6.000000000000000,STEEL,1927,44765,RUST HOLE,1,,,,C,GONZALES,148-171,5.000000000000000,15.000000000000000,"FOUND LEAK ON 6"" STL. MAIN USED 6""X 12"" CLAMP FOR REPAIR.",34.097972790000000,-118.381667899999997,10.0000000000000000,1.0000000000000000
65088,MAIN,23-Jun-13,1360 MONTE PLACENTIA WY,10' EW MONTE PLACENTIA WY,140' SS HIGHLAND GORGE,2.000000000000000,STEEL,1927,45047,RUST HOLE,1,,,N/A,B,SMITH,146-162,7.000000000000000,13.000000000000000,"LOCATE LEAK, HAND DUGDUE TO UTILITES IN WAY, INSTALL 2""X 8"" CLAMP, BACKFILL & TEMP, MADE P/U JOB COMPLETE.",34.095628910000002,-118.415132099999994,10.0000000000000000,1.0000000000000000
65092,MAIN,24-Jun-13,8294 PRESSON PL,7' NS PRESSON PL,149' EE MARMONT AVE,4.000000000000000,STEEL,1926,42785,RUST HOLE,1,,,SLIGHT,DECOMP GRANITE,SCHWEINBOLD,148-174,5.000000000000000,15.000000000000000,"REPAIRED 4"" STL WATER MAIN LEAK WITH REDWOOD & CLAMP. BACKFILLED, TAMPED, & OILED. HELP MAKE PICK-UP. CLEAN & SWEPT AREA.",34.099087050000001,-118.370204700000002,10.0000000000000000,1.0000000000000000
65243,MAIN,3-Jul-13,5633 BRIARCLIFF,30' EW BRIARCLIFF,360' SS VERDE OAK,4.000000000000000,STEEL,1924,34659,RUST HOLE,1,,,BAD,SANDSTONE,WASHINGTON,152-192,4.000000000000000,8.000000000000000,"INSTALLED 4""X 7"" 360 DEGREE CLAMP. BACKFILLED OILED 3'X 2' EXCAVATION, NEED MODERATE PICK-UP LEFT BARRICADED & SAFE.",34.108958739999998,-118.313085400000006,10.0000000000000000,1.0000000000000000
65246,MAIN,5-Jul-13,1618 SUNSET PLAZA DR,8' W/E SUNSET PLAZA DR.,78' N/N SUNSET PLAZA TERR,6.000000000000000,STEEL,1927,44765,RUST HOLE,1,,,,,JIMENEZ,148-171,4.500000000000000,13.500000000000000,"ARRIVED AT JOBSITE SET UP HEAVY TRAFFIC DELINEATION W/ FLAGMEN PINPOINT LEAK EXCAVATED, REPAIRS COMPLETE, BACKFILLED, TEMP OIL, CLEAN UP. JOBSITE SAFE.",34.100746080000000,-118.381060500000004,10.0000000000000000,1.0000000000000000
65255,MAIN,11-Jul-13,RUNYON CYN S/O MULHOLLAND,30' WE RUNYON CANYON RD,4335 SS MULHOLLAND,6.000000000000000,STEEL,1926,43116,RUST HOLE,1,,,BAD,GRANITE,WASHINGTON,152-180,5.500000000000000,11.000000000000000,"LARGE HOLE IN MAIN CAUSED LARGE WASH OUT - INSTALLED 6""X 1"" CALMP WITH PLUG - GATE MAN HAD TO BE CALLED OUT LEFT BARRICADED & TAPED OFF FOR DITCH INSPECTOR WILL NEED LOAD OF OIL & SM SCOOP CONROCK",34.111415880000003,-118.351478200000003,10.0000000000000000,1.0000000000000000
65259,MAIN,15-Jul-13,1405 SUNSET PLAZA DR,9' SN SUNSET PLAZA DR,737' EE RISING GLEN RD,6.000000000000000,STEEL,1929,48083,,1,,,,LOAM,SPEARS,146-171,4.500000000000000,13.500000000000000,"REPAIRED 6"" STEEL MAIN RUST HOLE LEAK WITH A LARGE SCREW PIN.",34.096302389999998,-118.382541700000004,10.0000000000000000,1.0000000000000000
65258,MAIN,15-Jul-13,1414 SUNSET PLAZA DR,9' SN SUNSET PLAZA DR,775' E/E RISING GLEN RD,6.000000000000000,STEEL,1929,48083,RUST HOLE,1,,,NONE,LOAM,SPEARS,146-171,5.000000000000000,15.000000000000000,"REPAIRED 6"" STEEL RUST HOLE LEAK WITH 6""X 8"" 360 DEGREE CLAMP.",34.096151560000003,-118.382392899999999,10.0000000000000000,1.0000000000000000
65260,MAIN,16-Jul-13,100 S BEACHWOOD DR,22' NS 1ST ST,42' EE BEACHWOOD DR,6.000000000000000,C.I.,1920,27188,SPLIT,1,,,MED,CLAY,SCHWEINBOLD,138-189,5.500000000000000,11.000000000000000,"REPAIRED SPLIT ON CI WM WITH CLAMP. BACKFILLED, TAMPED, & OILED. HELP MAKE PICK UP. SWEPT & CLAENED AREA.",34.073599770000001,-118.321575699999997,10.0000000000000000,1.0000000000000000
65263,MAIN,18-Jul-13,8045 FAREHOLM DR,2' EW FAREHOLM COURT,8' NS FAREHOLM DR,8.000000000000000,STEEL,1964,83844,,1,,,,C,GONZALES,148-177,6.500000000000000,19.500000000000000,"FOUND LEAK ON 1"" CORP STOP WITH MAIN SHUT DOWN REMOVED CORP STOP. INSTALLED NEW CORP. STOP.",34.102553989999997,-118.364206800000005,10.0000000000000000,1.0000000000000000
65265,MAIN,19-Jul-13,8466 CARLTON WAY,10' NN CARLTON WAY,500' EE QUEEN RD,12.000000000000000,STEEL,1954,71423,,1,,,,,GONZALES,148-174,5.000000000000000,15.000000000000000,"HAD WELDERS WELD 2"" COUPLING OVER SCREW PIN 12"" MAIN ABOVE GROUND.",34.097844449999997,-118.375418300000007,10.0000000000000000,1.0000000000000000
65279,MAIN,29-Jul-13,125 WINDSOR BLVD,266' SS 1ST ST,22' EW WINDSOR BLVD,4.000000000000000,C.I.,1920,27188,"CLAMP, SPLIT",1,,,,C,SPEARS,138-189,10.000000000000000,30.000000000000000,"SET UP TRAFFIC DELINEATION, LOCATED LEAK EXCAVATED AREA APPLIED 4X 12 REPAIR CLAMP, BACKFILLED, CLEANED UP LEFT SITE SAFE.",34.072381180000001,-118.319728400000002,10.0000000000000000,1.0000000000000000
65282,MAIN,30-Jul-13,RUNYON CYN & MULHOLLAND DR,1196' SS MULHOLLAND DR,,6.000000000000000,STEEL,1926,43116,ROUND CRACK,1,,,,,JIMENEZ,154-180,5.000000000000000,13.500000000000000,"FOUND RUST HOLE ON 6"" STL WATER MAIN REPAIRS W/ 360 DEGREE REPAIR CLAMP SET UP HEAVY PEDESTRIAN DELINEATION, LOCATED WM, STAR DRILLED ON ASPHALT, EXCAVATED ON DIRT SIDE, PROSPECT, MADE REPAIRS, BACKFILLED CLEAN UP JOB SITE SAFE.",34.117779560000002,-118.351223899999994,10.0000000000000000,1.0000000000000000
65385,MAIN,1-Aug-13,2632 HOLLYRIDGE DR,10' SN ON RIGHT A WAY OFF HOLLYRIDGE DR,12' WW HOLLYRIDGE ON R/W,2.000000000000000,STEEL,1929,48563,RUST HOLE,1,,,MED,SANDY CLAY,SCHWEINBOLD,152-189,8.000000000000000,24.000000000000000,"REPAIRED 2"" STL WATER MAIN WITH CLAMP. BACKFILLED, TAMPED, & OILED. HELP MAKE PICK-UP. CLEAN & SWEPT AREA.",34.114084949999999,-118.318381500000001,10.0000000000000000,1.0000000000000000
65387,MAIN,2-Aug-13,1571 SUNSET PLAZA DR,4' SN SUNSET PLAZA DR,12' WW SUNSET PLAZA PL,6.000000000000000,STEEL,,,RUST HOLE,1,,,,,SALDIVAR,148-171,14.000000000000000,56.000000000000000,"SET UP TRAFFIC, BROKE AND WHEN DIGGING FOR REPAIRS ON A MAIN LEAK HIT A 3"" GAS SERVICE, IT WAS MISMARKED, STAYED LATE TO COMPLETE REPAIRS UNTIL GAS CO MADE THEIRS.",34.099293619999997,-118.380447099999998,10.0000000000000000,1.0000000000000000
65388,MAIN,3-Aug-13,1203 CHEROKEE,44' NN LEXINGTON AVE,17' EW CHEROKEE,4.000000000000000,C.I.,,,RUPTURE,1,,,,,JIMENEZ,146-186,8.000000000000000,24.000000000000000,"FOUND RUPTURE ON 4"" CI WATER MAIN W/ 1- 3/4"" SERVICE INVOLVED, CUT IN 5' DI PIPE REFIT 1- 3/4"" SERVICE, BACKFILLED, TEMP OIL, CLEAN UP, LARGE SPOIL PICK UP NEEDED FOR MONDAY 08/03/13. JOBSITE SAFE.",34.092759940000001,-118.335247800000005,10.0000000000000000,1.0000000000000000
65391,MAIN,5-Aug-13,2261 VERDE OAK DR,16' VERDE OAK DR,22' SS HOLLY OAK DR,6.000000000000000,STEEL,1923,34123,RUST HOLE,1,,,,B,JIMENEZ,152-192,5.500000000000000,16.500000000000000,"FOUND RUST HOLE ON 6"" STL WATER MAIN, REPAIRED W/ 6X 8 CLAMP, BACKFILLED, TEMP OIL, CLEAN UP,JOBSITE SAFE.",34.111333539999997,-118.311148399999993,10.0000000000000000,1.0000000000000000
65392,MAIN,6-Aug-13,552 PLYMOUTH BLVD,32' EW PLYMOUTH BLVD,56' NN 6TH ST,4.000000000000000,C.I.,1915,21480,CLAMP,1,,,MED,SAND,SCHWEINBOLD,134-189,6.000000000000000,18.000000000000000,"REPLACED OLD LEAKING CLAMP WITH PLUG IN TAP HOLE. BACKFILLED, TAMPED, & OILED. HELP MAKE PICK-UP. CLEAN & SWEPT AREA.",34.063882010000000,-118.322892800000005,10.0000000000000000,1.0000000000000000
65394,MAIN,7-Aug-13,9101 HAZEN DR,1' WE EASMENT N/O HAZEN DR,89' SS MULHOLLAND DR,6.000000000000000,STEEL,1935,54060,RUST HOLE,1,,,,,JIMENEZ,154-168,7.000000000000000,21.000000000000000,"ARRIVED AT JOBSITE, WALK UP PROPERTY, INVESDTIGATED, FOUND WATER MAIN BEHIND PROPERTY ON RIGHT A WAY, HAD  TO HIKE UP WITH TOOLS, EXCAVATED BY HAND, FOUND 2 RUST HOLES ON 6"" STL WATER MAIN, REPAIRED W/ 2-6X 8 CLAMP, HEAVY ROOT JOB, BACKFILLED W/ NATIVE S",34.118733859999999,-118.395749199999997,10.0000000000000000,1.0000000000000000
65395,MAIN,7-Aug-13,2620 JALMIA DR,7' EW JALMIA DR,89' SS JALMIA PL,6.000000000000000,STEEL,1946,64525,RUST HOLE,1,,,,LOAM,SPEARS,154-177,7.500000000000000,22.500000000000000,"REPAIRED RUST HOLE LEAK IN 6"" STEEL MAIN WITH A LARGE SCREWPIN.",34.118928510000003,-118.360739800000005,10.0000000000000000,1.0000000000000000
65404,MAIN,12-Aug-13,2219 VERDE OAK DR,12' EW VERDE OAK DR,8' SN VALLEY OAK DR,6.000000000000000,STEEL,1923,34123,RUST HOLE,1,,,SLIGHT,DECOMP GRANITE,SCHWEINBOLD,152-192,7.500000000000000,22.500000000000000,"REPAIRED 6"" STL WATER MAIN WITH REDWOOD & CLAMP. BACKFILLED, TAMPED, & OILED. MADE PICK-UP. CLEAN & SWEPT AREA.",34.110245829999997,-118.312136800000005,10.0000000000000000,1.0000000000000000
65839,MAIN,12-Aug-13,4015 WOODCLIFF ROAD,11' W/C WOODCLIFF RD.,3' N/C KINGSWOOD LANE,16.000000000000000,C.I.,1954,70431,JOINT,1,,,,,M. OBREGON,164-144,8.000000000000000,24.000000000000000,"HIT LEAD JOINT BACKFILLED. (16"")",34.143368729999999,-118.467529200000001,10.0000000000000000,1.0000000000000000
65832,MAIN,14-Aug-13,4012 PROSPECT AVE,20' NS PROSPECT AVE,130' WW SANBORN AVE,4.000000000000000,C.I.,1925,41854,SPLIT,1,,,OK,CLAY,PRECIADO,148-201,7.500000000000000,15.000000000000000,"FOUND SMALL LEAK AT BOTTOM OF 4"" MAIN INSTALLED 360 DEGREE REPAIR CLAMP & BACKFILL WITH CON ROCK & TEMP.",34.101783550000000,-118.279102300000005,10.0000000000000000,1.0000000000000000
65407,MAIN,15-Aug-13,263 S IRVING BLVD,19' EW IRVING BLVD,198' NN 3RD,6.000000000000000,C.I.,,,SPLIT,1,,,,,SALDIVAR,136-189,10.000000000000000,30.000000000000000,"VERY HARD TO FIND MAIN LEAK, ONCE FOUND MADE REPAIRS WITH A 6""X 12"" 360 DEGREE REPAIR CLAMP. BACKFILLED. TEMP OIL, LEFT SAFE & CLEAN.",34.069599930000003,-118.318475500000005,10.0000000000000000,1.0000000000000000
65410,MAIN,20-Aug-13,101 N MCCADDEN,20' EW MCCADDEN,48' NN 1ST ST,6.000000000000000,C.I.,1925,35240,RUPTURE,1,,,,,JIMENEZ,138-183,5.500000000000000,16.500000000000000,"FOUND LARGE RUPTURE ON 6"" CI WATER MAIN W/ SOME STREET DAMAGE, RAISED CONCRETE STREET. CUT IN 5' OF DI, BACKFILLED, TEMP OIL, CLEAN UP, JOB SITE SAFE.",34.073822509999999,-118.337183499999995,10.0000000000000000,1.0000000000000000
65417,MAIN,23-Aug-13,535 N ROSSMORE AVE,20' EW ROSSMORE AVE,376' NN ROSEWOOD AVE,6.000000000000000,C.I.,1922,29561,ROUND CRACK,1,,,NONE,CLAY,SPEARS,140-186,13.500000000000000,37.500000000000000,"CUT IN 8' OF 6"" D.I. PIPE TO REPAIR LEAK.",34.080055899999998,-118.327226499999995,10.0000000000000000,1.0000000000000000
65419,MAIN,24-Aug-13,7940 WILLOW GLEN RD,17' NS WILLOW GLEN RD,572' WW WOODSTOCK RD,6.000000000000000,STEEL,1928,47672,RUST HOLE,1,,,NONE,DG,BRAYBOY,154-174,8.000000000000000,16.000000000000000,LEFT LARGE PICK-UP W/S STREET 7940 WILLOW GLEN SITE SAFE 1ST THING FOR DITCH INSPECTOR.,34.119212269999998,-118.370901900000007,10.0000000000000000,1.0000000000000000
65426,MAIN,26-Aug-13,7997 WILLOW GLEN RD,10' WW WILLOW GLEN RD,534' NN DOMINION WAY,6.000000000000000,STEEL,1936,47672,RUST HOLE,1,,,NONE,LOAM,SPEARS,156-174,7.000000000000000,14.000000000000000,"REPAIRED RUST HOLE LEAK ON 6"" STEEL MAIN WITH MEDIUM SCREW PIN.",34.119836579999998,-118.371048400000006,10.0000000000000000,1.0000000000000000
65422,MAIN,26-Aug-13,1645 SUNSET PLAZA DR,7' SN SUNSET PLAZA DR,80' WW HALSAM TERRACE,6.000000000000000,STEEL,,,"CLAMP, RUST HOLE",1,,,,,SALDIVAR,148-171,9.000000000000000,27.000000000000000,"MADE REPAIRS ON A 6"" STL MAIN LEAK, REMOVED OLD 6""X 8"" 360 DEGREE REPAIR CLAMP, GASKET WAS BURNED OUT, USED A 1"" REDWOOD PLUG AND A SERVICE CLAMP. TIGHT SPACE TO WORK NEXT TO SERVICE CORP.",34.101351930000000,-118.381271900000002,10.0000000000000000,1.0000000000000000
65840,MAIN,29-Aug-13,4012 FARMOUTH DR,146' WW AMESBURY RD,14' SN FARMOUTH DR,6.000000000000000,D.I.,1956,74188,RETAIN,1,,,,,HOOVER,154-201,7.000000000000000,14.000000000000000,"RETAINED 6"" GATE VALVE & 45 DEGREE BEND FOR SEWER CONTRACTOR TO REMOVE THRUST BLOCK THAT WAS COVERING SEWER MAIN.",34.118104010000003,-118.282252999999997,10.0000000000000000,1.0000000000000000
65428,MAIN,29-Aug-13,9610 HIGHLAND GORGE DR,11' WE MONTE PLACENTIA WAY,8' SS HIGHLAND GORGE DR,2.000000000000000,C.I.,,,RUST HOLE,1,,,,,SALDIVAR,146-162,7.000000000000000,21.000000000000000,"2"" C.I. MAIN LEAK REPAIR",34.095895239999997,-118.415098200000003,10.0000000000000000,1.0000000000000000
66103,MAIN,6-Sep-13,2620 JALMIA DR,9' EW JALMIA DR,89' SS JALMIA PL,6.000000000000000,STEEL,1946,64525,RUST HOLE,1,,,NONE,LOAM,SPEARS,154-177,8.000000000000000,16.000000000000000,REPAIRED RUST HOLE LEAK WITH  SCREW PIN.,34.118945519999997,-118.360736799999998,10.0000000000000000,1.0000000000000000
66108,MAIN,7-Sep-13,5635 BRIARCLIFF RD,5' WE BRIARCLIFF RD,348' NN VERDEOAK DR,4.000000000000000,STEEL,1924,34659,RUST HOLE,1,,,NONE,LOAM,SPEARS,152-192,4.000000000000000,8.000000000000000,"REPAIRED 4"" STEEL RUST HOLE LEAK WITH 4""X 8"" 360 DEGREE CLAMP.",34.109000500000000,-118.313036499999995,10.0000000000000000,1.0000000000000000
65552,MAIN,8-Sep-13,3002 MAXWELL ST,22' WE ETTRICK ST,30' SS MAXWELL ST,4.000000000000000,C.I.,1924,33926,SPLIT,1,,,,,UNGSON,152-204,8.500000000000000,16.500000000000000,"BROKE OUT CONCRETE STREET; EXCAVATED DOWN TO 4"" C.I. MAIN FOUND SPLIT @ BOTTOM; INSTALLED 4""X 12"" 3600 DEGREE CLAMP; BACKFILLED W/ CONROCK; TEMP. OIL; LEFT SITE CLEAN & SAFE.",34.111973970000001,-118.271404799999999,10.0000000000000000,1.0000000000000000
66114,MAIN,8-Sep-13,843 S SIERRA BONITA,22' EW SIERRA BONITA,418'SS EIGHTH STREET,4.000000000000000,C.I.,1924,32732,RUPTURE,1,,,,ADOBE,WASHINGTON,134-180,5.000000000000000,10.000000000000000,"HAD 3 GATE SHUT OFF. REPAIRED RUPTURE ON 4"" CI MAIN WITH 4""X 12"" 360 DEGREE CLAMP. BACKFILLED/ CLEAN UP & OK COMPLETE.",34.059372269999997,-118.355124599999996,10.0000000000000000,1.0000000000000000
66118,MAIN,10-Sep-13,6250 ROCKCLIFF DR,7' WE ROCKCLIFF DR,98' LEDGEWOOD DR,8.000000000000000,STEEL,1931,51007,RUST HOLE,1,,,MED,DECOMP GRANITE,SCHWEINBOLD,158-189,5.500000000000000,16.500000000000000,"REPAIRED 8"" STL WATER MAIN WITH REDWOOD & CLAMP. BACKFILLED, TAMPED, & OILED. HELP MAKE PICK-UP. CLEAN & SWEPT AREA.",34.128061660000000,-118.321736099999995,10.0000000000000000,1.0000000000000000
66135,MAIN,10-Sep-13,1581 N CRESCENT HTS BLVD,15' NS CRESCENT HTS BLVD,81' EW HOLLYWOOD BLVD,4.000000000000000,STEEL,1928,46891,RUST HOLE,1,,,,,SALDIVAR,148-174,4.000000000000000,13.000000000000000,"MADE REPAIRS ON A 4"" STEEL MAIN LEAK, BACKFILLED, TEMP OIL, LEFT JOB SITE SAFE AND CLEAN.",34.100016740000001,-118.367351900000003,10.0000000000000000,1.0000000000000000
66138,MAIN,11-Sep-13,1915 GRACE AVE,15' EW GRACE AVE,135' NN FRANKLIN AVE,6.000000000000000,C.I.,1923,12500,ROUND CRACK,1,,,,,SCHWEINBOLD,150-186,6.000000000000000,19.500000000000000,"REPAIRED 6"" CI WATER MAIN WITH CLAMP. BACKFILLED, TAMPED, & OILED. HELP MAKE PICK-UP. CLEAN & SWEPT AREA.",34.105688620000002,-118.332150100000007,10.0000000000000000,1.0000000000000000
65557,MAIN,13-Sep-13,2317 SAINT GEORGE ST,146' NN FRANKLIN AVE,22' EW SAINT GEORGE ST,6.000000000000000,C.I.,1925,41819,,1,,,,,HOOVER,150-201,8.000000000000000,32.000000000000000,"REPAIRED LEAK ON 6"" CI MAIN. BACKFILLED, TEMP ASPHALT, CLEAN UP, LEFT SITE SAFE.",34.105912089999997,-118.278604400000006,10.0000000000000000,1.0000000000000000
65553,MAIN,19-Sep-13,2825 GLENDALE BLVD,76' SS ROKEBY ST,,6.000000000000000,C.I.,,,RUST HOLE,1,,,,,ARIAS,150-207,3.000000000000000,9.000000000000000,"MAIN STARTED LEAKING AFTER SERVICE RETAP EXCAVATING WAS PERFPRMED. FOUND RUST HOLE 2 FEET INSIDE BANK. EXCAVATED. INSTALLED 6""X 12"" 360 DEGREE REPAIR CLAMP.",34.108100659999998,-118.263715800000000,10.0000000000000000,1.0000000000000000
66242,MAIN,21-Sep-13,6614 LASH LN,11' SN LASH LN,67' WW WHITLEY TERR,8.000000000000000,C.I.,1927,45885,SPLIT,1,,,NONE,CLAY,SPEARS,152-186,8.000000000000000,48.000000000000000,"CUT IN 7' OF 8"" DI PIPE TO REPAIR 8"" C.I. MAIN SPLIT.",34.110452029999998,-118.333749299999994,10.0000000000000000,1.0000000000000000
66246,MAIN,23-Sep-13,1959 GRACE AVE,13' E/W GRACE AVE,475' NN FRANKLIN AVE,6.000000000000000,C.I.,1929,32500,RUPTURE,1,,,THICK,LOAMY CLAY,SCHWEINBOLD,150-186,9.000000000000000,27.000000000000000,"REPLACED 6' OF CI WATER MAIN WITH DI PIPE. BLOCKED IN PLACE. FLUSHED. BACKFILLED, TAMPED, & OILED. USED BACKHOE TO HELP DIG OUT RAISED ASPHALT & POT HOLES & REASPHALTED. CLEAN & SWEPT AREA.",34.106670950000002,-118.332153300000002,10.0000000000000000,1.0000000000000000
66245,MAIN,23-Sep-13,1820 EL CERRITO PL,187' NN FRANKLIN AVE,18' EW EL CERRITO PL,8.000000000000000,C.I.,1953,53798,,1,,,,,JIMENEZ,150-183,13.500000000000000,40.500000000000000,"FOUND LONG SPLIT ON 8"" CI WATER MAIN, CUT IN 14' OF DI PIPE W/ 1- 1"" SERVICE INVOLVED, REFIT SERVICE, BACKFILL, TEMP OIL, CLEAN UP, JOB SITE SAFE.",34.104567480000000,-118.345066700000004,10.0000000000000000,1.0000000000000000
66255,MAIN,24-Sep-13,1401 SUNSET PLAZA DR,10' S/N SUNSET PLAZA DR.,81' EE RISING GLEN RD,6.000000000000000,STEEL,1929,48083,RUST HOLE,1,,,,,SALDIVAR,146-171,9.000000000000000,27.000000000000000,"MADE REPAIRS ON A 6"" STEEL MAIN LEAK. BACKFILLED, TEMP OIL, LEFT JOB SITE SAFE AND CLEAN.",34.096525880000002,-118.383059399999993,10.0000000000000000,1.0000000000000000
